{
  "version": 1,
  "id": "unconfigured-control-diagnostic",
  "viewports": ["desktop"],
  "cases": [
    {
      "id": "unconfigured.ble-profile",
      "steps": [
        { "action": "navigate", "path": "/Roadex", "status": 200, "cacheControl": "no-store" },
        { "action": "selectOption", "testId": "project-selector", "valueSource": "unconfiguredProject" },
        { "action": "assertAttributeValue", "testId": "project-selector", "attribute": "data-profile-configured", "value": "false" },
        { "action": "selectFirstOption", "testId": "thread-selector", "labelPrefix": "Active" },
        { "action": "assertAttributeValue", "testId": "verify-ble", "attribute": "data-profile-configured", "value": "false" }
      ]
    },
    {
      "id": "unconfigured.ble-disabled",
      "steps": [
        { "action": "navigate", "path": "/Roadex", "status": 200, "cacheControl": "no-store" },
        { "action": "selectOption", "testId": "project-selector", "valueSource": "unconfiguredProject" },
        { "action": "assertAttributeValue", "testId": "project-selector", "attribute": "data-profile-configured", "value": "false" },
        { "action": "selectFirstOption", "testId": "thread-selector", "labelPrefix": "Active" },
        { "action": "assertEnabled", "testId": "verify-ble", "state": false }
      ]
    },
    {
      "id": "unconfigured.usb-profile",
      "steps": [
        { "action": "navigate", "path": "/Roadex", "status": 200, "cacheControl": "no-store" },
        { "action": "selectOption", "testId": "project-selector", "valueSource": "unconfiguredProject" },
        { "action": "assertAttributeValue", "testId": "project-selector", "attribute": "data-profile-configured", "value": "false" },
        { "action": "selectFirstOption", "testId": "thread-selector", "labelPrefix": "Active" },
        { "action": "assertAttributeValue", "testId": "observe-usb", "attribute": "data-profile-configured", "value": "false" },
        { "action": "assertAttributeValue", "testId": "verify-esp32", "attribute": "data-profile-configured", "value": "false" }
      ]
    },
    {
      "id": "unconfigured.usb-disabled",
      "steps": [
        { "action": "navigate", "path": "/Roadex", "status": 200, "cacheControl": "no-store" },
        { "action": "selectOption", "testId": "project-selector", "valueSource": "unconfiguredProject" },
        { "action": "assertAttributeValue", "testId": "project-selector", "attribute": "data-profile-configured", "value": "false" },
        { "action": "selectFirstOption", "testId": "thread-selector", "labelPrefix": "Active" },
        { "action": "assertEnabled", "testId": "observe-usb", "state": false },
        { "action": "assertEnabled", "testId": "verify-esp32", "state": false }
      ]
    },
    {
      "id": "unconfigured.flash-profile",
      "steps": [
        { "action": "navigate", "path": "/Roadex", "status": 200, "cacheControl": "no-store" },
        { "action": "selectOption", "testId": "project-selector", "valueSource": "unconfiguredProject" },
        { "action": "assertAttributeValue", "testId": "project-selector", "attribute": "data-profile-configured", "value": "false" },
        { "action": "selectFirstOption", "testId": "thread-selector", "labelPrefix": "Active" },
        { "action": "assertAttributeValue", "testId": "flash-firmware", "attribute": "data-profile-configured", "value": "false" }
      ]
    },
    {
      "id": "unconfigured.flash-disabled",
      "steps": [
        { "action": "navigate", "path": "/Roadex", "status": 200, "cacheControl": "no-store" },
        { "action": "selectOption", "testId": "project-selector", "valueSource": "unconfiguredProject" },
        { "action": "assertAttributeValue", "testId": "project-selector", "attribute": "data-profile-configured", "value": "false" },
        { "action": "selectFirstOption", "testId": "thread-selector", "labelPrefix": "Active" },
        { "action": "assertEnabled", "testId": "flash-firmware", "state": false }
      ]
    },
    {
      "id": "unconfigured.console",
      "steps": [
        { "action": "navigate", "path": "/Roadex", "status": 200, "cacheControl": "no-store" },
        { "action": "selectOption", "testId": "project-selector", "valueSource": "unconfiguredProject" },
        { "action": "assertAttributeValue", "testId": "project-selector", "attribute": "data-profile-configured", "value": "false" },
        { "action": "selectFirstOption", "testId": "thread-selector", "labelPrefix": "Active" },
        { "action": "assertNoBrowserErrors" }
      ]
    }
  ]
}
